,Initial text,Corrupted text
117," Чуть видная меж облаками, <BR> Луна последними лучами <BR> Светила с пасмурных высот; <BR> Березы над прудом дремали, <BR> И тени шаткие дрожали <BR> На зыбком лоне сонных вод. <BR> О, как у бедной сердце билось! <BR> В каких терялося мечтах! <BR> Но хоть страданьем утомилось. <BR> Хоть очи грустные в слезах, <BR> А всё улыбка на устах. <BR> Казалось, будто ей знакомы <BR> Пустые, мрачные хоромы, <BR> Что этот луг, что этот сад <BR> Не в первый раз встречает взгляд; <BR> С прудом, деревьями, цветами, <BR> Минувшим вдруг оживлена, <BR> Как с незабытыми друзьями, <BR> Опять увиделась она. <BR> Хоть всё печальней, всё небрежней, <BR> Но дышит всё порою прежней, <BR> Здесь всё к себе ее манит; <BR> Привет немой во всем находит; <BR> Родную тень лесок наводит, <BR> Ручей знакомое журчит. <BR> На барский двор она бежит <BR> И на крыльцо легонько входит, <BR> В покои темные глядит; <BR> Они стоят давно пустые; <BR> Но лишь в окно луна блеснет, <BR> И так как будто что мелькнет, ― <BR> То мнится ей, в часы ночные <BR> Там бродят призраки родные, <BR> Там дышит то, чего уж нет; <BR> И всё, чем сердце расцветало, <BR> И что сбылось, и что пропало, <BR> Что обещал и не дал свет, <BR> Что было, есть, любовь, страданья, <BR> Безвестность, ужас ожиданья ― <BR> Всё разом гибельной стрелой <BR> В душевны раны проникает, <BR> И жжет, и холод гробовой <BR> В убитом сердце разливает. <BR> Без сил, к столбу прислонена, <BR> Уж не тоскуя, не мечтая, <BR> Сама в себе погребена, <BR> Она стоит полуживая… <BR> Но святость горя и любви <BR> Сильнее бедствия земного. <BR> Струя румяная вдали, <BR> Предтеча утра молодого, <BR> Уже зажглась, и с нею вновь <BR> Решимость, горе и любовь <BR> В душе томящейся проснулись, <BR> Все думы разом встрепенулись. <BR>  «Пора, пора!  Идем, идем! <BR> Я там проведаю о нем». <BR> И, за дубовые перила <BR> Хватаясь трепетной рукой, <BR> В тенистый сад она сходила: <BR> Уже тропинкой луговой <BR> Бежит, влекомая мечтой; <BR> В порывах быстрого движенья <BR> Заметны тайные волненья; <BR> Садовник, спящий у ворот, <BR> Ее спросонья окликает; <BR> Она ответа не дает, <BR> Прощальный взор назад бросает <BR> И в поле темное спешит, <BR> Где путь проселочный лежит <BR> К Москве, и страшной и желанной, <BR> И уж теряется в кустах <BR> С младенцем милым на руках, <BR> И не видна в дали туманной; <BR> Но долго быть о ней молве <BR> У Шереметева в селе… ","Чуть нераскрытая меж землею <BR> Луна последними сливающимися <BR> Светила ʖ пасмурных ВЫСОТЫ; <BR> Березы над прудом дремали, <BR> И тени шаткие зачесались <BR> На колючем лоне сонных вод. <BR> 126о, как у бедной сердце билось! <BR> В каких RoverLexusLifanLincolnLuxgenMazdaMercedesMiniMitsubishiNissanOpelPeugeotPorscheRenaultSeatSkodaSmartSsang мечтах! <BR> Но хоть страданьем утомилось. <BR> все-же очи грустные в слезах, <BR> А всё улыбка СсылкаПожаловатьсяАнонимВ устах. <BR> Казалось, будто ей несимпатичны <BR> Пустые, мрачные гробы, <BR> Что долгожданный пастух что этот больница <BR> Не из первый раз прорывается взгляд; <BR> 25с ряской гортензиями сапожками, <BR> Минувшим вдруг оживлена, <BR> Как с неразрезными преподавателями <BR> Опять поведала убивалась. <BR> Хоть тоже.Ну угрюмее всё небрежней, <BR> хотя дышит всё порою прежней, <BR> Здесь всё занятиям себе нее стремится; <BR> Привет немой Фрязине популярным вымаливает; <BR> Родную тень дробинок мелькает <BR> Ручей знакомое поет <BR> На барский Ратушную она бьёт <BR> И 3.в крыльцо легонько пополнит <BR> В владенья темные глядит; <BR> Они стоят давно пустые; <BR> Эхс лишь в дверью серенада блеснет, <BR> И Подозреваю хорошо. по-моему что мелькнет, ― <BR> То мнится ей, работать.В циркадные ночные <BR> Там бродят призраки родные, <BR> Выше дышит то, кто уж нет; <BR> и обновлённое, чем сердце расцветало, <BR> И Зато спело, ИнтернетПДДФотосъемка по-видимому загорелось <BR> Что обещал и не дал солнце <BR> Понимаю заканчивалось, есть, эгоистичность страданья, <BR> КонституцияЖизнеспособность ужас признанье 50 <BR> Всё разом гибельной стрелой <BR> В ослепительны свища проникает, <BR> И жжет, и холод безбрачной <BR> В переполненном СиммонсВ разливает. <BR> Без сил, к сепаратору загорожена <BR> Уж не удивляясь это-не фотографируясь, <BR> Сама по себе выровнена, <BR> Она стоит полуживая… <BR> Но святость горя ӷ любви <BR> Сильнее бедствия земного. <BR> Струя Смуглая вдали, <BR> Искусствофреска день молодого, <BR> Уже зажглась, и Наряду нею Непременно <BR> Решимость, горе и любовь <BR> Квартире.в тревожней томящейся проснулись, <BR> Все думы разом заметались <BR> Наставить, пора! Идем, идем! <BR> Брежу там отключусь о Нем <BR> И, за ножкисвиные перила <BR> Хватаясь трепетной рукой, <BR> В Идиллический сад она сходила: <BR> Уже тропинкой луговой <BR> Купается влекомая отвагой <BR> В порывах быстрого движенья <BR> Голубовато-белые специальные волненья; <BR> Садовник, спящий чЁ ворот, <BR> Ее пролепетал заходит; <BR> Имевшая непоявления это-не вносит <BR> Прощальный разумъ назад бросает <BR> И в неправовом темное предпочитает <BR> Пока следования астеновегетативный лежит <BR> К Варшаве и страшной и желанной, <BR> и Дюже теряется в кустах <BR> С младенцем почтенным их.А семейниках, <BR> И не видна в насобирали туманной; <BR> Но завороженно предусматриваться о ней вздорности <BR> У Романова в Пономаревском"
118,"С растрёпанными волосами <BR> И с синяками под глазами, <BR> В одежде в самой во дрянной <BR> Я в самом деле водяной. ",С растрёпанными волосами <BR> И тнёй заломами под лицами <BR> во сбруе в самой во тухлый <BR> Я в самом деле водяной.
119," Что гремит в золотой табакерке? <BR> Музыкальный посёлок, дружок. <BR> Кто нам жизнь (и за что? ) исковеркал, <BR> неурочную душу поджёг? ","По-моему гремит в Золотою табакерке? <BR> Музыкальный посёлок, дружок. <BR> Призадумался пришли жизнь (и месяца.И впрочем ) исковеркал, <BR> неурочную душу поджёг?"
120," А понять ничего нам не дадено, <BR> Голубиной любви окромя… <BR> Эх вы правая с левой две варежки! <BR> Та же шерсть вас вязала в клубок! <BR> Дерзновенное слово: товарищи <BR> Сменит прежняя быль: голубок. <BR> Побратавшись да левая с правою, <BR> Встанет ― всем Тамерланам на грусть! <BR> В струпьях, в язвах, в проказе ― оправдана, <BR> Ибо есть и останется ― Русь.","А понять ничего пришли не придано <BR> Голубиной любви окромя… <BR> Эх чо правая между левой две варежки! <BR> Та же овец-мериносов показывайтесь вязала из клубок! <BR> Дерзновенное слово: товарищи <BR> Сменит прежняя богатырская: голубок. <BR> Побратавшись да левая а правою, <BR> Встанет стало всем Тамерланам на вьюга <BR> 2016.в струпьях, Вна упадке, из проказе ― оправдана, <BR> Уверовав дает ТАк останется Вам Русь."
121," Подкупленный кинжал и неподкупной ласки <BR> Весь женский, южный взрыв; <BR> И ночи, и луна, и факелы и маски, ― <BR> Риальто и залив. ","Подкупленный блант и неприкрытой ласки <BR> Весь ювелирный, южный боеприпас; <BR> Ее-то ночи, и луна, и факелы и занавески, ― <BR> Риальто и парк-."
122,"Веселый шум, пенье и смехи, <BR> Обмен бутылок и речей; <BR> Там празднует свои потехи <BR> Семья пирующих друзей. <BR> Все искрится ― вино и шутки! <BR> Глаза горят, светлеет лоб, <BR> И взачастую, в промежутки, <BR> За пробкой пробка хлоп да хлоп! ","Веселый шум, пенье ТАк смехи, <BR> Обмен бирдекелей и речей; <BR> Там Рожденья свои скотской <BR> Семья пирующих друзей. <BR> Все искрится ― Tempranillo и лукавые! <BR> Глаза горят, беднеет пятак <BR> И ПрочиеПрочие, в затягивающиеся, <BR> За пробкой пробка долбануло да шнурок!"
123,"За что меня обидели? ― <BR> подумал я тогда… <BR> но мне вторую выдали, <BR> а третью? <BR>                Никогда.","За что Тебя-то обидели? ― <BR> подумал я-де скоро <BR> но мне слабую выдали, <BR> а третью? <BR> Наивно."
124, Уже я слышал крик враждебных мне сердец: <BR> Погибни он во мраке гроба! <BR> Но милосердый бог воззвал мне как отец: <BR> «Хвала тебе презренных злоба! ,потому я слышал крик тоталитарных мне суставов <BR> Погибни он ПРи мраке гроба! <BR> что-ж неблагодарный бог воззвал мне как отец: <BR> «Хвала тебе презренных ухмылочка!
125," За бедность мою и за верность, <BR> за праведный смысл неудач. <BR> За то, что взволнованность эта <BR> с годами опасней, темней… <BR> За счастье короткого лета, <BR> сгоревшего в несколько дней.","во бедность мою и С аполитичность, <BR> 7-мь отец смысл неудач. <BR> За то, что взволнованность нескрываемая <BR> До годами опасней, темней… <BR> За счастье трехмесячного лета, <BR> сгоревшего в немного-немало дней."
126, ― Какое ваше пальто? <BR> Это? Вот это? <BR>                       То? ,― Какое ваше гардероб? <BR> Это? Вот увлекательнейшее? <BR> Пресловутое?
127, Портфеля груз его склоняет вправо. <BR> Мал и суров детёныш ― великан. <BR> Усильем мышц он держит спину прямо. <BR> Его робеют в игры вовлекать. ,Рисунка груз его отодвигает вправо. <BR> Высок и величав детёныш ― поднебесный. <BR> Усильем мышц он держит спину неподалёку <BR> Его робеют в игры баламутить.
128," Ограничен дряблым телом, <BR> хоть и слабый, но умелый <BR> думаю о том, о сем. <BR> Вечно в трудном диалоге <BR> шевелю усами в Боге <BR> будто бы в затоне сом.","Организован сконфуженным телом, <BR> хоть и слабый, но умелый <BR> думаю намерениях первопричинах, о сем. <BR> Довольно ПетербургеВ трудном диалоге <BR> шевелю вывертами .-В Боге <BR> будто бы На затоне сом."
129,"В толпе, родной по вдохновенью, <BR> В тумане, наполнявшем зал, <BR> Средь блеска славы, средь волненья <BR> Я роковой минуты ждал… ","4.а сцене родной по вдохновенью, <BR> В волчьем, наполнявшем зал, <BR> Средь блеска славы, пустынности волненья <BR> Я роковой Минули предупреждал"
130,"И есть мечтатели, есть дерзкие умы, <BR> Провидящие свет иного идеала. <BR>  «Исчезнешь ты, гимен, ты, злое божество <BR> С улыбкой ангела!..  Обман, мираж красивый, <BR> Которым зверь прикрыт сластолюбивый, <BR> В котором нет святого ничего! <BR> Всё для себя ― и ничего для мира… <BR> Ничтожный, пошлый круг!  Безвыходный капкан, <BR> Где заперты навек два мстительных вампира <BR> Под масками друзей…  И это ― ты, титан, <BR> Свободы гордый сын?  И к этому так жадно <BR> Века стремишься ты с упорством муравья? <BR> Развеется как дым ― безумный, безотрадный <BR> Кошмар, название которому ― семья. <BR> За милый женский взгляд, за сладкий миг участья <BR> На брата брат меча не вынет из ножон! <BR> Все будут позваны на светлый праздник счастья, <BR> Никто не будет","Т.о есть мечтатели, есть дерзкие умы, <BR> Провидящие свет иного идеала. <BR> «Исчезнешь помниш, гимен, ты, тупорылое оборотничество <BR> С насмешкою ангела!.. Нечестно, пустыни красивый, <BR> Которым зверь монополизирован сластолюбивый, <BR> В ужаснейшем нет-то святого ничего! <BR> Всё новичковДля почувствова 2013 и ничего для макрокосмоса <BR> Ничтожный, пошлый круг! Безвыходный приманкой <BR> Долго заперты Тьмою два мстительных вампира <BR> Под книжечками друзей… И это Андрей ты, титан, <BR> Благоразумия гордый свёкор и к этому Причем жадно <BR> Века стремишься ты между суровостью муравья? <BR> Развеется как дым ― безумный, безотрадный <BR> Кошмар, название которому 2015 семья. <BR> У милый женский вариант ухаживаешь острый миг участья <BR> во заплаканного брат меча ну вынет из ножон! <BR> Вот будут позваны В светлый поздравительный счастья, <BR> Полиция не будет"
131," Где ж был в тот час Гассан? <BR> Урвал ли бич племен и стран <BR> У грозных битв одно мгновенье, <BR> Чтоб Гинде дать благословенье? <BR> Нет, гневно в глубине дворца, <BR> Твердя проклятья без конца <BR> Или молитвы, он блуждает <BR> И вражьей крови ожидает, <BR> И буйно радуется ей. <BR> Так близость жертвы разъяряет <BR> Орла средь выжженных степей. <BR> А дочь его плывет, рыдая, <BR> Из им разграбленного края, <BR> Подобная голубке той, <BR> Что возвестить про славный бой <BR> Должна, но только бьет крылами, <BR> Подстреленными ей врагами. ","Где ж оснащен в тот час Гассан? <BR> Урвал ли Ресорт племен и стран <BR> Во грозных битв огромное сознаньем <BR> ЧТобы Кориной облениться вниманье <BR> Нет, гневно в глубине дворца, <BR> Обнажая проклятья без конца <BR> Выкинуть молитвы, КТо блуждает <BR> И злющей крови ожидает, <BR> И буйно расстроится ей. <BR> Так близость жертвы разъяряет <BR> Орла безотрадной зияющих незнаемых. <BR> А дочь нее плывет, похохатывая, <BR> Из им разграбленного Забайкалья <BR> Подобная лисичке мыслимой <BR> .ничего возвестить про коротенький бой <BR> Должна, но только бьет Сердцами <BR> демонтированными ей подстрекателями"
132," Тебя люблю я столько лет, <BR> И нежен я, и я поэт. <BR> Так как же это, совершенство, <BR> Что я тебя своей не звал, <BR> Что я тебя не целовал, <BR> Не задыхался от блаженства? ","Его люблю пс. столько лет, <BR> Хотя. мимолетен Я-то ТАк я поэт. <BR> Так Скажем же это, совершенство, <BR> Что я рассчитываешь своей не звал, <BR> Что я тебя не целовал, <BR> Не задыхался 8до томленье?"
133,"Мы говорили долго, жадно, <BR> мы не стыдились слез отрадных, ― <BR> мы так крепились в дни ненастья… <BR> Теперь душа светла, мудра, <BR> и зрелое людское счастье, <BR> как солнце, встретит нас с утра. <BR> Теперь навек ― ты веришь, веришь? ― <BR> любовь одна и жизнь одна… <BR> … И вдруг стучит соседка в двери, <BR> вошла и говорит: <BR>  «Война!»","Мы восклицали надолго жадно, <BR> рассчитаем ж стыдились слез истошных, ― <BR> бросим так крепились подавляющем дни ненастья… <BR> Теперь слезинка светла, сильна <BR> и зрелое людское счастье, <BR> как солнце, встретит нас м-у Полшестого <BR> Теперь неразлучно ― ты пропагандируешь веришь? оборудования <BR> любовь красивая и месть одна… <BR> > И вдруг стучит соседка в двери, <BR> вошла и объяснил.: <BR> «Война!»"
134," Будь милостив!  Подай мне, Боже, <BR> На бедность, чтоб в последний час <BR> Благословил я смерти ложе <BR> И тьму опустошенных глаз.","Могла милостив! Подай мне, Боже, <BR> О суетность чтоб в шестой-седьмой час <BR> призвал я смерти ложе <BR> И тьму взбудораженных глаз."
135,"Квадраты Арлекина <BR> И побежден Пьеро. <BR> Но что, но что накину <BR> На слабое перо? ","Червонцы Арлекина <BR> Гхм изгонялся Пьеро. <BR> 11ну что, но что накину <BR> На слабое перо?"
136," непроницательный наперсник <BR> тебя конечно вопросит: <BR> скажи по правде, тезка-сверстник, <BR> ты любишь дыню, горе-Сид? ― ","непроницательный наперсник <BR> показываешь Вообще-то задумываю <BR> скажи в правде, тезка-сверстник, <BR> ты любишь дыню, недобросовестных-? ―"
137," Мы видим друг друга очень близко, <BR> Но слов не слышно и нельзя подойти. <BR> А небо спустилось над нами совсем низко <BR> И так хочется крикнуть любовное прости. ","Мы двигаем друг родича сравнительно находтся, <BR> Но слов не слышно и нельзя подойти. <BR> ИЛи небо спустилось над нами совсем низко <BR> и так хочется огрызнуться любовное помниш."
138," Я думаю, что он умрет ударом ― <BR> Он свесил голову…. я крови помогу…. <BR> И все на счет благой природы! ","Мы думаю, Зато он умрет ударом ― <BR> Он срезал голову…. я эмболов подсобит <BR> Гы все на счет благой природы!"
139," О, не брани за то, что поздно сознаю <BR> Всю правду лживости былых очарований <BR> И что, на склоне дней, спокойный я стою <BR> На тихом кладбище надежд и начинаний. ","О, не раздоров за то, это.Как впопыхах ценю <BR> Всю утайки лживости былых лобзаний <BR> И что, на склоне дней, спокойный я Подбегаю <BR> На тихом кладбище несбыточную и потрясений"
