,Initial text,Corrupted text
260,"Минуты две они молчали, <BR> Но к ней Онегин подошел <BR> И молвил: «вы ко мне писали, <BR> Не отпирайтесь.  Я прочел <BR> Души доверчивой признанья, <BR> Любви невинной излиянья; <BR> Мне ваша искренность мила; <BR> Она в волненье привела <BR> Давно умолкнувшие чувства; <BR> Но вас хвалить я не хочу; <BR> Я за нее вам отплачу <BR> Признаньем также без искусства; <BR> Примите исповедь мою: <BR> Себя на суд вам отдаю. ","Минуты оба мексы молчали, <BR> Вроде к ней Онегин подошел <BR> и молвил: «вы ко мне писали, <BR> Не дёргайте. Я прочел <BR> Души доверчивой желаюИ <BR> Любви невинной излиянья; <BR> Мне расчудесная искренность 2016мила <BR> Любочка человек.В волненье превести <BR> Давно разбиравшие чувства; <BR> Но вас хвалить я не хочу; <BR> Россиия за нее вам нанесу <BR> Отсветом частенько без искусства; <BR> Проявляйте причитание мою: <BR> Твоей у прецедент вам отдаю."
261," Кровь из носу без устали текла. <BR> Быть приобщен хотел Святых он Таин, <BR> Но страшная на нем печать была: <BR> Вкруг рта ― все кровь, и он глядел ― как Каин. ","Расплавленное из полубаке без освоились текла. <BR> Быть воспроизведенный хотел Святых он Таин, <BR> Но страшная на малюсеньком печать была: <BR> Вкруг рта данный все плазма МФУФаксы он глядел ― ежели Каин."
262,"Я люблю сигнал зеленый, <BR> знак свободного пути. <BR> Нелюбимой, невлюбленной, <BR> хорошо одной брести. ","Я люблю сигнал медно-красный <BR> множитель свободного самоосуществления. <BR> Нелюбимой, невлюбленной, <BR> хорошо немногочисленной брести."
263," Виват!  все дети возглашают, <BR> Екатерина, наша мать, <BR> И агарян тем ужасают, <BR> Стремясь оружием попрать. <BR> Враги хоть сильно разъяренны <BR> И от врагов же поощренны, <BR> Мнят тьмою толп победу взять; <BR> Но лишь едва на то польстятся, <BR> Как войны россов все стремятся <BR> Самих их обращати вспять. ","Еврострой! все дети возглашают, <BR> Екатерина, наша мать, <BR> И агарян тем ожидаемы, <BR> Стремясь оружием попрать. <BR> Враги хоть обостренно разъяренны <BR> И РФОт врагов же поощренны, <BR> Освой дремотой толп пοбеда взять; <BR> Так Наверное едва на т.п.Если мультиплексируются <BR> Как войны Несторов тоже стремятся <BR> Говорящих их обращати вправо-вниз"
264," Но мудрых нет как нет у нас, <BR> Во век их не было у вас, <BR> И мы, и вы <BR> Без головы… ","Но мудрых нет положено НЕТУ у нас, <BR> Во век Ý не было у вас, <BR> В.т заработаем, КСZ вы <BR> Без головы…"
265,"Царица вечно-ясная, <BR> Душа моей души! <BR> Зову тебя, прекрасная, <BR> Зову тебя, спеши! ","Царица вечно-ясная, <BR> Армия моей души! <BR> Зову разыгрываешь, прекрасная, <BR> Ропщу безума, спеши!"
266," И то был Петербург!  И шедший рядом <BR> В шинелишке худой совсем промерз, <BR> Но шел вперед с остекленевшим взглядом <BR> И видел всё на много сотен верст. ",И значит был Петербург! Гады пересекавшей рядом <BR> В шинелишке худой совсем подмерзли <BR> Точнее шел вперед взаимодействуя зажмуренными взглядом <BR> И видел всё на много полусотней верст.
267," Зарница на небе проблещет, <BR> Не расцвечая пыльный путь, <BR> Где травка хилая трепещет, <BR> И где в канавках дремлет жуть. ","Зарница направленных грешном проблещет, <BR> Не Сочинив пыльный просветлению <BR> Где травка косячная трепещет, <BR> И где качество.В канавках дремлет жуть."
268,"Гуманный внук воинственного деда, <BR> Простите нам, наш симпатичный князь, <BR> Что русского честим мы людоеда, <BR> Мы, русские, Европы не спросясь!.. ","либеральный внук воинственного деда, <BR> Простите нам, наш аппетитный князь, <BR> А-а многоязычного честим ВЫ людоеда, <BR> Мы, церковные, Европы не спросясь!.."
269," Он, втапоры, под прыть <BR> Пелёнок, пряток, <BR> Прогулок, рёва, салок, <BR> Салазок, жмурок ― <BR> Ни шаток был, ни валок: <BR> Скорее юрок. <BR> И трус, и в морду ― бац; <BR> Герой лапты; <BR> И умник, и паяц… ","Он, greenOVATIONPetlasPlanetPlesPrimexRacing, под грузность <BR> Пелёнок, пряток, <BR> Прогулок, гогота консерваций, <BR> Пристаньгорностаевкаиивановкаккаланчаккамышаныкаховканнижние, гиганских ― <BR> 1.о шаток начинался ни валок: <BR> Поскольку юрок. <BR> И трус, ТАк в морду ― бац; <BR> Героях лапты; <BR> И умник, и фраке"
270," Ты близ меня: в кипеньи и во льде, <BR> В пылу труда и в мареве недуга, <BR> В будильнике, под веером досуга, <BR> В добре и зле, в любви и во вражде.","Ты близ меня: из живописиMaimeri и во льде, <BR> В пылу труда 뵽 в кромешного досадного, <BR> В будильнике, под веером досуга, <BR> В добре То зле, Китай.В личной и беременностиВ вражде."
271," Среди цветов невестой мудрой <BR> Свою увидеть в девах мать, <BR> Неощутимо с ней летать, <BR> Глубокоокой, темнокудрой; ","Среди цветов короной мудрой <BR> Промежуточную увидеть 35в девах мать, <BR> Неощутимо с ней летать, <BR> ГидроизоляцияНатяжной Симпатичной"
272,"  «Царствует ныне в Видарбе царь Бима, до старости поздней <BR> В славе доживший; а странница эта есть Дамаянти, <BR> Дочь видарбинского Бимы, жена нишадского Наля. <BR> Наль же, сын Виразены, бывший владыка Нишады, безумно <BR> В кости все царство свое проиграл недостойному брату. <BR> С той поры, покинув Нишаду с женою, пропал он <BR> Без вести.  Бима послал нас отыскивать дочь.  И случайно <BR> В вашем царском дворце в печальной, таинственной гостье <BR> Вашей узнал я ее…  И кто не узнал бы?  На свете <BR> Нет Дамаянти другой, столь прекрасной душою и телом. <BR> Есть притом и примета: на лбу под густыми <BR> Кудрями светлая скрыта звезда, как за облаком месяц; <BR> С нею она родилася; ее сам Брама заметил <BR> Знаком святым благодати; но знак сей одним лишь браминам, <BR> Видящим здесь красоту неземную, служителям Брамы, <BR> Может быть видим; и я очами брамина, как злато <BR> В темной руде, как в пепле горячем огонь сокровенный, <BR> Тотчас узнал Дамаянти, красы несказанной светило». <BR> Кончив рассказ свой, Судева умолк.  Тут царевна Сунанда, <BR> Тихо подкравшись к подруге, с ее головы покрывало <BR> Вдруг сорвала, и кудри волос, осенявших прекрасный <BR> Лоб видарбинской царевны, откинула: ярко, как месяц, <BR> Тучу пронзивший, блеснула оттуда звезда благодати. <BR> То увидя, Сунанда в слезах умиленья припала <BR> К сердцу ее, царица заплакала также; и все три, <BR> Крепко обнявшись, слиянные сердцем, стояли безмолвно, <BR> Слезы сливая с слезами.  Вот напоследок сказала <BR> Мать царица: «Ты дочь моей сестры, Дамаянти. <BR> Наш знаменитый отец был владыка дафернский Судеман; <BR> Бима выбрал сестру, меня избрал Виравагу. <BR> Я и тебя младенцем видала в то время, когда мы <BR> Вместе с сестрой навестили В Даферне отца.  И тогда уж <BR> Эта звезда сияла на лбу у тебя.  Догадалась <BR> Тотчас я, кто ты, как скоро ты странницей грустной явилась <BR> Здесь, и дочерью сердце тебя нарекло.  Оставайся ж <BR> С нами, мой дом есть твой; и все подвластное сыну <BR> Царство также твое.  Живи в любви и согласьи <BR> С нами: будь дочерью мне, будь нежной сестрою Сунанде». ― <BR>  «Долго я здесь незнакомкой в довольстве жила, ― отвечала <BR> Тетке своей Дамаянти; ― не знала нужды, под защитой <BR> Верной была, и в горе встречала веселье; но будет <BR> Мне веселее в Видарбе с родным отцом и с родною <BR> Матерью.  С миром меня отпусти; я давно уж с своими <BR> Ближними розно; отсюда слышится мне, как сиротки <BR> Дети мои, по матери плача, ее издалека <BR> Кличут и ей говорят: без отца мы, на что ж нам <BR> Быть и без матери?  Если свое благотворное дело <BR> Ты довершить надо мною желаешь, то дай мне скорее <BR> Средство в Видарбу к своим возвратиться».  ― «Исполнена будет <BR> Воля твоя, красота звездоносная», ― так отвечала <BR> Мать царица; потом с позволения сына, владыки <BR> Царства шеддийского, в путь снарядила милую гостью; <BR> Пищу с питьем на дорогу сама царевна Сунанда <BR> Ей приготовила; дали коней с колесницею; дали <BR> Также и стражей, дабы ее на пути охраняли; <BR> С плачем расстались потом.","«Царствует считавшимся в Видарбе царь Бима, в старости мрачной <BR> В славе доживший; Аж странница эта есть Рамешварам, <BR> Мачехи американского Бимы, жена нишадского Көн. <BR> Наль же, смышлёный Виразены, бывший владыка Нишады, безумно <BR> Цитатав кости Всё царство всеобщее разблокировал недостойному брату. <BR> Пб махонькой бреши заскочив Алтынорду с Дельфиной, пропал он <BR> Без вести. Чокто послушал нас почерпать дочь. и оплошала <BR> В вашем сторожевом дворце из печальной, таинственной гостье <BR> Вашей позаботился я ее… Бы кого-нибудь не узнал бы? Нашем свете <BR> Нет Дамаянти другой, столь прекрасной душою городаВойтиРегистрацияГлавная телом. <BR> Есть притом и примета: на лбу над густыми <BR> Кудрями светлая неразборчива звезда, далее.И 20тр пустым 30.000; <BR> У Вами некая родилася; ζωή сам Скота заметил <BR> Астрологией святым Бога-Слова но знак сей одним лишь дворикам, <BR> Зачарованным одном красоту неземную, служителям Вёльвы, <BR> Видите быть видим; ПКн- я очами Дзэна, Говорят влагою <BR> В классной Fe2, как в пепле горячем ОГОНЬ сокровенный, <BR> Тотчас узнал Дамаянти, красы чудовищной светило». <BR> Кончив портрет свой, Судева умолк. Тут царевна Сунанда, <BR> Тихо шарахнуться с подруге, с ее головы покрывало <BR> Вдруг сорвала, и кудри луковицах, проявлявших благодатный <BR> Лоб видарбинской Лизетты, откинула: ярко, как месяц, <BR> Лучиэнь вздрагивающий блеснула изпод крутящаяся благодати. <BR> Еас увидя, Сунанда в подкашивающихся умиленья припала <BR> Благодаря сердцу ее, Евдоксия заплакала также; и все триста <BR> Весело обнявшись, слиянные сердцем, стояли безмолвно, <BR> Ноги-Ноги сливая с слезами. Именно поаккуратнее выговаривала <BR> Мать Докия: «Ты дочь моей сестры, Дамаянти. <BR> Наш знаменитый отец был владыка дафернский Судеман; <BR> Бима выбрал сестру, равно избрал Виравагу. <BR> Иронизирую и тебя младенцем видала в ежли время, когда просматриваем <BR> Заодно с наперсницей навестили Г Даферне отца. И почему-же дюже <BR> Эта звезда застлала .Несмотря лбу Отними тебя. Догадалась <BR> Тотчас я, кого-нибудь тебе как юудет ты странницей грустной явилась <BR> Здесь, и дочерью наважденье тебя нарекло. Оставайся тієї <BR> С нами, мой загородныйдом есть твой; и безконечные подвластное сыну <BR> Благовествование также твое. Живи в добродетельной и согласьи <BR> С нами: демонстрируй супружницей мне, будь нежной Асей Сунанде». ― <BR> «Долго я-де здесь нимфой в довольстве формировалась ― отвечала <BR> Тетке своей Дамаянти; uralpress.ru не угадывала возобновляемости, под защитой <BR> Верной была, и в Мтацминда встречала веселье; но будет <BR> Мне предметнее в Видарбе информации.С тамбовским отцом и с сестрицей <BR> Драконом. 1996.- миром меня отпусти; я сооовсем ыы с вдохновенными <BR> фитильными розно; оттеда расслышал мне, по-тому отшельницы <BR> Дети робкие по матери плача, ее чибисов <BR> декоративныеКлючницыКлоуныГобеленКартыРыцари и ей говорят: без тетушки Пьём, на что ж нам <BR> Дружить и без матери? Впоследствии свое болезненное дело <BR> Ты навязаться надо мною навредишь тО дай мне скорее <BR> Средство в Израилебазалиомавитилигогипергидроздерматитпсориазэкземакардиологиякардиология пО своим перебираться ― «Исполнена просчитываться <BR> Воля твоя, красота звездоносная», uralpress.ru звучит отвечала <BR> Мать царица; скоре с позволения сына, Святителя <BR> Царства шеддийского, по путь снарядила милую гостью; <BR> Пищу обнаружением питьем на школу сама царевна Сунанда <BR> Ненавистно приготовила; пожелали коней года.На колесницею; дали <BR> Также и стражей, дабы ее фотоНа пути подорвали; <BR> С25 плачем расстались потом."
273,"― Но тот, кто и жизнь, и себя отпоёт, <BR> Тот Божьему слуху не нужен. ― <BR> Окно говорит да и войлок орёт <BR> Так хрипло, как будто простужен. ","― Но тот, кто ТАк жизнь, и малоподвижную отпоёт, <BR> Тот Божьему полудюжине не потерян стало <BR> Окно говорит яне и войлок орёт <BR> Так хрипло, как.Как Наверно простужен."
274,"Недавно темною порою, <BR> Когда пустынная луна <BR> Текла туманною стезею, <BR> Я видел ― дева у окна <BR> Одна задумчиво сидела, <BR> Дышала в тайном страхе грудь, <BR> Она с волнением глядела <BR> На темный под холмами путь. ","Недавно темною порою, <BR> Любопытно Равнинная Дивная <BR> Хотек чуждою стезею, <BR> Я видел ― дева у занавесы <BR> Одна задумчиво сидела, <BR> Дышала к тайном рефлекторном грудь, <BR> Молоденькая с восхищеньем глядела <BR> На темный над холмами путь."
275,"И плакать хочется, и хочется смеяться, <BR> Как вспомнишь о былом; <BR> Как можно было мне так горько ошибаться <BR> В самом себе, и в людях, и во всем… ","И драться заставляю ТАк хочется вскрикивать <BR> Как вспомнишь русах нерушимом <BR> Как можно было мне так горько понимать <BR> В самом себе, и в людях, и во проблемным"
276," А твое лицо, как прежде, <BR> В нежно-золотом загаре, <BR> И медовые веснушки <BR> Выступают на щеках. ","В,д твое лицо, кстати прежде, <BR> во нежно-золотом загаре, <BR> И медовые Пятнышки <BR> Выступают на складочкам."
277," Тыщи лет он уже обходился <BR> без меня, обойдется и впредь. <BR> Я почти говорить разучился, <BR> научился любить и глазеть. ","50кк лет чи вновь обходился <BR> без меня, Поможет и впредь. <BR> Я почти говорить разучился, <BR> научился спасать эх глазеть."
278,"что же станет с плотью бедной? <BR>  Верно, вечной станет плоть, <BR> так в любви своей безмерной наградит её Господь ― <BR> а земля всё стынет, стынет, спит пророк, приняв вина. <BR> Ветер зябнущей пустыни, месяц, камни,","Так yжe Послужит от плотью высокопоставленной <BR> Верно, вечной станет плоть, <BR> Равно в неудачливости своей безмерной наградит её Пророкъ далее <BR> а житница всё стынет, стынет, спит пророк, приняв вина. <BR> Камыш зябнущей пустыни, месяц, камни,"
279," Уронив лобяной облом <BR> В руку, судорогой сведенную, ― <BR> Громче, громче!  ― Под плеск знамен <BR> Не взойдет уже в залу тронную! ","Перепрыгивая Минусовой облом <BR> В руку, судорогой сведенную, 11 <BR> лиричнее громче! ― Под плеск знамен <BR> Не обрушится совершеннно в залу тронную!"
280," Роберт!  Роберт!  ― ваш чудный взор <BR> Так жжет меня зачем? <BR> Двух душ неслышный разговор, <BR> Боюсь, понятен всем… ― ","Кевин Роберт! \ ваш чудный взор <BR> Так жжет меня зачем? <BR> Двух ванной-джакузи неслышный толковище, <BR> Боюсь, понятен пользующимся 50"
281,"В больничное гляну окно, а там, за окном, ― Пироговка, <BR> и жизнь, и судьба, и надежда, и горечь, и слава, и дым. <BR> Мне старость уже не страшна, но всё-таки как-то неловко <BR> мешать вашей праздничной рыси неловким галопом своим. ","во больничное гляну Панорамное, ИЛи Оттуда за корпусом, ― Пироговка, <BR> и война и успешность, и надежда, и горечь, и поклонение и дым. <BR> Мне старость уже не обманчива круто. всё-таки как-то неловко <BR> мешать вашей купальской рыси неловким резво своим."
