,Initial text,Corrupted text
406," Земля, как зацветающая новь, <BR> Блаженная, лежала предо мною ― <BR> И первый стих и первая любовь <BR> Пришли ко мне с могилой и весною. ","Ведическая, как зацветающая новь, <BR> Побежденная, лежала предо кем-нибудь ― <BR> И первый стих и первая любовь <BR> Двинулись ко мне 3с могилой рейсмусаМетизы Проталины."
407," но есть ответ, и он предельно прост. <BR> По крайней мере так считается, <BR> по крайней мере всё вокруг кончается <BR> и вот перед тобою закачается <BR> тот самый пресловутый мост <BR> над водами несчастья и отчаянья, ","но лежат ответ, и он фривольно прост. <BR> По общемто мере так редкостью, <BR> качественному одной вероятностью всё вокруг кончается <BR> и вот перед тобою закачается <BR> кого самый пресловутый мост <BR> превосходстве водами добросердечия и упрека,"
408," Но если бы знал я, что больше не встану, <BR> Что негде спастись от последнего сна, <BR> Последнюю ночь, изменивши привычке, <BR> Я мирно провел бы на правом боку.","однако если бы Скрывал ЗаВадН, что больше не переложу <BR> Что негде спастись от последнего сна, <BR> Ударную заутреню изменивши привычке, <BR> Я шикарно провел то.И на правом боку."
409," Ложью чувств не отравляю, <BR> Но заботливо опять <BR> Ей над бровью поправляю <BR> Разметавшуюся прядь. ","Ложью чувств не отравляю, <BR> Но заботливо чуть-что <BR> Натану между бровью осматриваюсь <BR> Разметавшуюся прядь."
410, И пока общий шов ― <BR> Льюсь!  ― не наложишь Сам ― <BR> Рано еще для льдов <BR> Потусторонних стран!,И себе.Если общий перевязку ― <BR> Льюсь! 50 не наложишь Описывал ― <BR> Слишком еще для льдов <BR> Потусторонних компаний-потребителей!
411," и пока она ставит баррель на баррель свои желтоватые башни, <BR> и пока она на веревочке водит самонапрягающееся слепое пятно <BR> серебристых хранилищ, схлопнувшихся в направлении внешнем, <BR> и пока на изнанке твоей лобной кости она пробегает диалоговое окно, ","и чего она откидывает инфляция мирВ баррель свои желтоватые башен-близнецов <BR> и пока она на веревочке пополняет самонапрягающееся раздражительное пятно <BR> серебристых хранилищ, схлопнувшихся в двинувшись внешнем, <BR> и пока основано изнанке твоей копчика кости она пробегает черенковское окно,"
412," Всплываем, играем <BR> и пеним волну. <BR> На свадьбу речную <BR> зовем мы луну. <BR> Всё тише качаясь, <BR> туманный жених <BR> на дно опустился <BR> и вовсе затих. <BR> И вот осторожно, <BR> до самого дна, <BR> до лба голубого <BR> доходит луна. <BR> И тихо смеется, <BR> склоняясь к нему, <BR> Царица-Русалка <BR> в своем терему.","Всплываем, играем <BR> и пеним волну. <BR> До свадьбу Мариинскую <BR> зовем мы затемненную. <BR> Всё тише пританцовывая <BR> скудный свинопас <BR> на дно поспешил <BR> мультимедиа.2 Опять-таки свернулся <BR> И это осторожно, <BR> до неопытного Литоринового, <BR> до лба голубого <BR> доходит луна. <BR> И миленько смеется, <BR> подходя к неприметному, <BR> Царица-Русалка <BR> в своем кушаке"
413," Вижу я правость твою и скорби резоны, <BR> Да позволь, если можно, сказать без препоны <BR> И мне мое мнение, дружески советы; <BR> А притом ведай, что я лукавых приметы ― <BR> Лесть, похлебство ― не люблю, но что помышляю <BR> В сердце, то и устами другу открываю. <BR> Не пустое дело есть знатная порода; <BR> Знаю я, сколь изящно славного быть рода, <BR> Носить на себе имя, еже вечна слава, <BR> Знаменитое в войнах, в хранении права; <BR> Но то, когда потомок, предкам подражая, <BR> В путь добрых ся направив, отбегает злая, <BR> Когда делы хвальными в пользу всех сияет, <BR> От себя себе красу ― не от своих чает. <BR> Признаю, что с корене сего так рожденны <BR> Отрасли неправедно бывают презренны, <BR> Что неправо заслуги забыты бывают <BR> Предков, когда потомки в нравах успевают, <BR> И в равном достоинстве что предпочесть должно <BR> Благородного ― спорить никому не можно; <BR> Но что, когда корень здрав, да отрасли гнилы? <BR> Ведь те уж не так честны, не так уж всем милы. <BR> Спросись хоть у пьяницы, таковы ли дрожжи <BR> Любы ему, как пиво, ― отречется трожжи. <BR> Знает он, что с пива те славные остатки, <BR> Да плюет на то, коли не, как пиво, сладки. <BR> Благородство голое, добрых дел лишенно, ― <BR> Суетно для ленивых имя вымышленно, <BR> Которые, крася ся чуждыми делами, <BR> Хвастают честью, юже не достали сами. <BR> Верю: мужества предков летописцы полны, <BR> Грамоты, в гербе знаки ― доводы довольны; <BR> Да что в сем собрании славы неполезной, <BR> Коли ничто показать можешь в поднебесной? <BR> Разве ссохший пергамент, который чрез лета <BR> Долгая от червей мог избежать навета. <BR> Коли, с хвального ключа ведучи начало, <BR> Ничего не имеешь, чтоб роду пристало, <BR> Глупою только надут гордостью не в меру, ― <BR> Лошадям только годен для статей к примеру; <BR> Не пользует, верь, зваться хоть цесарско чадо, <BR> Коли нравом грубее, неж пасущий стадо. <BR> Добродетель, к природе знатной соплетенна, <BR> Благородного чинит во всем совершенна; <BR> Труды, разум, прилежность и добрые нравы <BR> Лучшие благородству суть и крепки правы.","Вижу я правость тонкую и скорби шансы <BR> Да побудь если можно, сказать без препоны <BR> И меня мое Общественное, дружески советы; <BR> А вероятно возможешь что я лукавых приметы 70 <BR> Лесть, почте.восстановление ― не отличаю, но что понимаю.Я <BR> В сердце, пониаю и сынами солдату закрыла. <BR> Не пустое дело есть знатная Пикси-боб <BR> Знаю я, колоссально нежно уникального быть рода, <BR> Носить на себе имя, еже вечна судьба., <BR> Знаменитое в войнах, в хранении права; <BR> Но ВЫ, когда потомок, предкам подражая, <BR> В путь Прекрасных ся направив, отбегает злая, <BR> Хотя делы хвальными На пользу своих-то сияет, <BR> 04у себя кому-нибудь девицу ― не от своих пописывает <BR> Признаю, что с еяже превратного так сразят <BR> Отрасли неправедно бывают презренны, <BR> А-а уравнительное возмοжнοсти забыты бывают <BR> Предков, обнаруживаешь люди в нравах успевают, <BR> И себе.На бесконфликтном правах что предпочесть должно <BR> Благородного ― спорить немногим не можно; <BR> Притом что, ипотому корень здрав, да отрасли гнилы? <BR> Ведь рьез уж не так разборчивы не раньше-то сильно-то всем милы. <BR> Спросись хоть у пьяницы, таковы .что биорегуляторы <BR> Дуси Тайсону, как Выпивка ― отречется трожжи. <BR> Ведает он, что с полторашку тoт славные остатки, <BR> Да плюет на то, когда-когда это-не как пиво, покойны <BR> Филигранность нетронутое добрых дел лишенно, ― <BR> Скромный для сытых имя вымышленно, <BR> Которые, крася ся незамысловатыми делами, <BR> Хвастают расчетливостью, обретоша это-не достали сами. <BR> Верю: мужества дедовых вожди полны, <BR> Медаль, в гербе абрисы ― доводы довольны; <BR> Да чем-же в слышанном собрании славы неполезной, <BR> Коли ничто показать можешь СсылкаПожаловатьсяВ калифорнийской? <BR> Наверняка ссохший пергамент, который видев лета <BR> Долгая -2-3 червей выворачивался избежать навета. <BR> Коли, .-В фигового открывания ведучи завершающего, <BR> Бесполезно работает.И достигаешь чтоб роду приклеилось <BR> Глупою непосредственно надут успехами не в ярковато ― <BR> Лошадям давно.В бессмысленен для статей элитному Иными; <BR> Не вырабатывает, верь, преставиться хоть крестьянско чадо, <BR> Коли приличием грубее, неж искусил стадо. <BR> Добродетель, Подобно природе знатной соплетенна, <BR> Иллюзорного прокладывает во всем совершенна; <BR> Труды, разум, аполитичность ҽԺ добрые нравы <BR> Сегодняшние благородству суть и крепки правы."
414, У Егорки башка кольцами. <BR> А у волка ― космами <BR> Ну а уж мозгами сходственны: <BR> Одним гребнем чесаны. ,У Егорки башка кольцами. <BR> А у бультерьера ― венцами <BR> Эе а сильно-то мозгами обворожительны <BR> Одним гребнем кованы
415," Но не языческого края <BR> На нем одежда боевая: <BR> Ни шлема с пестрою чалмой, <BR> Ни брони с притчами Корана, <BR> Ни сабли нет на нем кривой, <BR> Ни золотого ятагана. <BR> Изгибы белого пера <BR> Над шапкой зыблются шелко́вой, <BR> Прямая шпага у бедра, <BR> На груди вышиты оковы, <BR> И, сброшена с его плеча, <BR> В широких складках величаво <BR> Падет на сбрую епанча <BR> С крестом зубчатым Калатравы. ","Но аесли греко-римского края <BR> На нем платьяОдежда боевая: <BR> Тагаз экипированного с безумною чалмой, <BR> Ни брони .От бодхисаттвами Османа, <BR> Зы секиру нет на нем кривой, <BR> Ни золотого ятагана. <BR> Изгибы высокопробного лобика <BR> Прежде шапкой зыблются шелко́вой, <BR> Прямая крылатка у бедра, <BR> 5.в груди вышиты оковы, <BR> И, переставлена с его нерва <BR> В широких тряпках величаво <BR> устремит на сбрую епанча <BR> С крестом симпатическим Калатравы."
416,"  «Вот кто послан мне судьбою! ― <BR> Шепчет юное созданье… ― <BR> Семь процентов, семь процентов! <BR> Это рай, очарованье!» ","Увидите кто-кто принесен на судьбою! ― <BR> Шепчет юное созданье… ГМВК <BR> ПЯТЬДЕСЯТ процентов, семь процентов! <BR> Это рай, очарованье!»"
417,"Эти конные ветки ― не снятся, <BR> Цокот замшевый их наяву, <BR> И готов я с прелестною жизнью обняться, <BR> Хоть и чуждым, и лишним слыву. ","Эти конные пальмочки ― не снятся, <BR> Цокот Стеганый их воображаем, <BR> А.и готов я любыми восточною жизнью забухать, <BR> Хоть и чуждым, и лишним слыву."
418," Все так же хороша. <BR> Не разнится ни в чем весенних дней с зарею. <BR> С середнею своей и младшею сестрою <BR> Приветлива, скромна и ласкова ко всем, <BR> Всечастно мать лобзает: <BR> А мать ее <BR> Объемлет, к сердцу прижимает, <BR> И на лице явя веселие свое, <BR> Разлуку забывает. <BR> Природа с них берет другой повсюду вид, <BR> И вкруг торжественно сияньем все блестит. <BR> Там горы, там леса играют, <BR> Там рыбы вверьх из вод как бы взлетают, <BR> Сверкая перьем, чешуёй; <BR> Повсюду, словом, все восторг являет свой. <BR> Прекрасны девы короводом <BR> И пляшут и поют, ея живяся взором. ","Все Хотя діе хороша. <BR> Не разнится Ну из чем весенних неделю.И с зарею. <BR> 260-261 рядПавелецкаяПавелецкаяПарк своей и славянку сестрою <BR> Приветлива, скромна B8- ласкова ко всем, <BR> Всечастно дочери просияет: <BR> А родственницу ее <BR> Закрепляет, к сердцу усыпает, <BR> И ДвоихDJ лице TMNTPlaymobilPlayskoolPOLtoysPuzzlePilotR-ToysRabbitRastarRealToyRevellRMZ веселие свое, <BR> разлук сосредотачивает <BR> Природа с них берет другой повсюду вид, <BR> -к вкруг торжественно сияньем все самоочищается. <BR> Там террасы, каких-нибудь леса играют, <BR> Там рыбине вверьх из вод нормально.Если есль разметают, <BR> Сверкая перьем, чешуёй; <BR> Повсюду, антонимом все умилении являет свой. <BR> Прекрасны девы короводом <BR> И хлопают .ее поют, ея живяся обликом"
419," Эх вы, русские наши проекты <BR> На убийство, на правду, на ложь! <BR> Открывая новую секту, <BR> Мы готовим для веры чертеж. ","Эх вы, русские басурманские проекты <BR> На убийство, на правду, : ложь! <BR> Открывая новую раннехристианскую, <BR> ВЫ готовим пригодную миссионерства чертеж."
420,"Я безумно боюсь золотистого плена <BR> Ваших медно-змеиных волос, <BR> Я влюблен в Ваше тонкое имя «Ирена» <BR> И в следы Ваших слез. ","он шибко боюсь золотистого отшельничества <BR> Ваших медно-змеиных волос, <BR> Я влюблен в Ваше технологичное имя Каринэ <BR> И в следы Ваших обморока"
421,"Шепчет: «Я не пожалею <BR> Даже то, что так люблю ― <BR> Или будь совсем моею, <BR> Или я тебя убью». <BR> Надо мной жужжит, как овод, <BR> Непрестанно столько дней <BR> Этот самый скучный довод <BR> Черной ревности твоей. <BR> Горе душит, не задушит, <BR> Вольный ветер слезы сушит, <BR> А веселье, чуть погладит, <BR> Сразу с бедным сердцем сладит.","Шепчет: «Я никт пожалею <BR> Именно то, Так так люблю ― <BR> Или иль совсем моею, <BR> Или чтоты .ты убью». <BR> Думала хозяином непереставая, Скажем Белощёкий, <BR> Непрестанно столько дней <BR> Этот специфический скучный довод <BR> Черной ревности твоей. <BR> Горе окутал, это-не задушит, <BR> Вольный ветер слезы сушит, <BR> Пфф веселье, чуть нашлет, <BR> Сразу от бездумным сердцем сладит."
422, В ярком истины зерцале <BR> Образ твой очам блестит; <BR> В горьком опыта фиале <BR> Твой алмаз на дне горит. ,В ярком истины зерцале <BR> Автопортрет твой дарованиям блестит; <BR> 57в горьком опыть фиале <BR> Твой алмаз загорелом мелководье горит.
423, Ударов редкий и хрустальный град <BR> Стал учащенней ― сделался железным ― <BR> Ошибок нежных огрубевший лад ― <BR> Ошибок грубых лад печально-нежный… ,Ударов редкий и хрустальный град <BR> Поступил учащенней ― сделался железным состоянии <BR> Ошибок фееричных огрубевший перепляс ― <BR> Мотивов суетливых лад печально-нежный…
424," Так что ж, друзья!  встав на ходули, <BR> Раскинем веером наш взор. <BR> Но наш единственный, от пули <BR> Не перекошенный забор ","То-есть что ж, друзья! протиснувшись нее.А ходули, <BR> Раскинем веером наш обозрев. <BR> Ес-но наш единственный, от пули <BR> ни перекошенный забор"
425," У Егорки губы красные, <BR> А у волка ― сизые. <BR> Оба до овец опасные: <BR> Одной слюнкой лизаны. ","У Егорки губы красные, <BR> А Вы волка ― сизые. <BR> Оба г.С серн опасные: <BR> Давней кляксой лизаны."
426," Немного бабка величала, <BR> Немного мать ― давным-давно, <BR> И не в твоей избе стучало <BR> С летящим голубем окно. ","Немного бабка величала, <BR> Немного мать 22 давным-давно, <BR> И не из твоей избе ревело <BR> С смытым гранатом угловое."
427," Мне нужно было отступленье: <BR> Читателю я доказал, <BR> Что службы долг мне не мешал <BR> Любить и книги и ученье. <BR> Теперь к Наташе я своей <BR> В восторге сердца обращаюсь. <BR> Вот месяц, как в деревне с ней <BR> Живу и жизнью наслаждаюсь. <BR> Хоть снег порхает по полям, <BR> Мы с нею резвимся, гуляем, <BR> При матушке, по вечерам, <BR> Романы, повести читаем; <BR> Старушка дремлет, и для нас <BR> Тем лучше: тысячу я раз <BR> У милой руку поцелую; <BR> Она в невинности своей <BR> Твердит, что я любезен ей; <BR> Я весел, счастлив, торжествую! <BR> Ах, без любви пустыня свет! ","Мне нужно было отступленье: <BR> Читателю я связал, <BR> Нетчто жандармерии долг подумала. не мешал <BR> Разучились и псалмы ТАк терпенья <BR> Вследствие с Айседоре я своей <BR> До восторге сердца обращаюсь. <BR> Вот год.Также по-моему 15В деревне с ней <BR> Живу и жизнью наслаждаюсь. <BR> Спецом снег порхает по полям, <BR> вы с нею резвимся, гуляем, <BR> ПРи матушке, по вечерам, <BR> Романы, повести следуем <BR> Старушка дремлет, БарбудаАргентинаАрменияБагамские для нас <BR> Тем надёжней тысячу я видели <BR> У милой руку зареву; <BR> Она продолжается.В материнства всякой <BR> Твердит, елси я любезен ей; <BR> Понимаю весел, роскошен, торжествую! <BR> Ах, оставляй любви зияющая свет!"
